method_family,current_gate,dense_status,moe_status,allowed_action,blocking_probe,why,literature_sources,source_links,primary_probe,failure_signal,same_shape_constraint
Uniform / linear average,rejected_as_default,reject_midpoint_for_current_qwen_dense_pair,reject_source_to_source_midpoint_for_current_qwen3_moe_pair,Use only as a negative baseline; do not materialize as the selected average.,connectivity_path_must_beat_endpoint_frontier,Dense midpoint worst NLL 6.0398 is far above the best lambda-family value 3.0727; Qwen3 MoE best interior worst NLL is above the best endpoint by 0.1189.,Model soups; Task arithmetic,"[{""short_name"": ""Model soups"", ""url"": ""https://arxiv.org/abs/2203.05482"", ""year"": ""2022""}, {""short_name"": ""Task arithmetic"", ""url"": ""https://arxiv.org/abs/2212.04089"", ""year"": ""2022""}]",endpoint score; lambda sweep; midpoint barrier; worst-task score,merged NLL higher than both endpoints; worst-task retention collapse,output checkpoint keeps target config/tokenizer/model class/tensor names/tensor shapes
Task arithmetic / coefficient search,conditional_allowed,allowed_only_with_heldout_lambda_selection,allowed_only_as_layer_expert_coefficient_rules,Search coefficients under endpoint fallback and same-shape writer constraints.,heldout_loss_or_vllm_gate_must_accept_coefficients,"Current Dense coefficient family selects lambda config {'code': 0.5414439073133305, 'general': 3.072743579141455, 'lambda': 0.0, 'mode': 'uniform', 'worst': 3.072743579141455}; Qwen3 MoE uses route/evidence/geometry coefficients rather than a global source delta.",Task arithmetic; AdaMerging; DAM,"[{""short_name"": ""Task arithmetic"", ""url"": ""https://arxiv.org/abs/2212.04089"", ""year"": ""2022""}, {""short_name"": ""AdaMerging"", ""url"": ""https://arxiv.org/abs/2310.02575"", ""year"": ""2023""}, {""short_name"": ""DAM"", ""url"": ""https://arxiv.org/abs/2410.08371"", ""year"": ""2024""}]",alpha/beta grid; layer cosine; held-in retention,best grid is endpoint; high plane barrier; layer-wise conflict,output checkpoint keeps target config/tokenizer/model class/tensor names/tensor shapes
Sign / sparsity conflict methods,conditional_diagnostic,diagnostic_until_it_beats_anchor,expert_ffn_only_after_alignment_never_raw_router,Emit tensor rules only for modules that pass held-out and vLLM gates.,sparse_rule_must_improve_worst_task_and_preserve_critical_tensors,Dense unified worst NLL 5.1830 is used as the held-out gate; sparse rules are not accepted just because sign conflict exists.,TIES; DARE; DELLA; STAR,"[{""short_name"": ""TIES"", ""url"": ""https://arxiv.org/abs/2306.01708"", ""year"": ""2023""}, {""short_name"": ""DARE"", ""url"": ""https://arxiv.org/abs/2311.03099"", ""year"": ""2023""}, {""short_name"": ""DELLA"", ""url"": ""https://arxiv.org/abs/2406.11617"", ""year"": ""2024""}, {""short_name"": ""STAR"", ""url"": ""https://arxiv.org/abs/2502.10339"", ""year"": ""2025""}]",sign conflict; weighted conflict; delta magnitude distribution; singular spectrum,large important deltas dropped; conflict concentrated in norms/lm_head/router,output checkpoint keeps target config/tokenizer/model class/tensor names/tensor shapes
Importance / activation-aware average,conditional_needs_calibration_match,fisher_is_not_sufficient_on_current_qwen_dense_probe,needs_route_conditioned_sensitivity_before_acceptance,Use Fisher/RegMean-style weights only after activation or NLL sensitivity predicts held-out behavior.,activation_covariance_or_fisher_prediction_must_match_actual_path_loss,"Dense curvature ratios general/code are 42.8604/26.6575, so local quadratic/Fisher evidence is too weak alone.",Fisher merging; RegMean++; FroM,"[{""short_name"": ""Fisher merging"", ""url"": ""https://arxiv.org/abs/2111.09832"", ""year"": ""2021""}, {""short_name"": ""FroM"", ""url"": ""https://arxiv.org/abs/2506.02478"", ""year"": ""2025""}, {""short_name"": ""RegMean++"", ""url"": ""https://arxiv.org/abs/2508.03121"", ""year"": ""2025""}]",diagonal Fisher; activation covariance; NLL sensitivity,calibration data does not match target tasks; off-plane residual is large,output checkpoint keeps target config/tokenizer/model class/tensor names/tensor shapes
Output-space calibrated average,active_moe_lever_pending_downstream_gate,available_when_output_residual_is_measured,router_route_kd_active_but_not_accepted_yet,"Train or fit output/router residual corrections, then require source/baseline vLLM dominance gates.",matched_baseline_source_candidate_vllm_eval_required,"Router-only calibration reduces linear MoE worst NLL by 0.2214, but final router-calibration selector status is awaiting_baseline_eval.",Output-space projection; MergeMoE; WEMoE,"[{""short_name"": ""WEMoE"", ""url"": ""https://arxiv.org/abs/2410.21804"", ""year"": ""2024""}, {""short_name"": ""MergeMoE"", ""url"": ""https://arxiv.org/abs/2510.14436"", ""year"": ""2025""}, {""short_name"": ""Output-space projection"", ""url"": ""https://arxiv.org/abs/2605.29101"", ""year"": ""2026""}]",output residual energy; source-logit KL; layer-wise projection residual,low parameter conflict but high output residual; soft objective does not transfer to sparse top-k dispatch,output checkpoint keeps target config/tokenizer/model class/tensor names/tensor shapes
Alignment before averaging,required_precondition,required_when_barrier_or_permutation_symmetry_is_detected,required_for_expert_gauge_qwen3_identity_currently_passes,Canonicalize or remap features/experts before any average; Qwen3 can use identity expert mapping for this pair.,expert_or_feature_matching_must_be_known_before_tensor_average,Real OLMoE same-name degradation is 5.4910 while aligned degradation is 0.0000; Qwen3 expert identity fraction is 1.0000.,Git Re-Basin; ZipIt; Sub-MoE; MergeMoE,"[{""short_name"": ""Git Re-Basin"", ""url"": ""https://arxiv.org/abs/2209.04836"", ""year"": ""2022""}, {""short_name"": ""ZipIt"", ""url"": ""https://arxiv.org/abs/2305.03053"", ""year"": ""2023""}, {""short_name"": ""Sub-MoE"", ""url"": ""https://arxiv.org/abs/2506.23266"", ""year"": ""2025""}, {""short_name"": ""MergeMoE"", ""url"": ""https://arxiv.org/abs/2510.14436"", ""year"": ""2025""}]",permutation residual; feature CKA; expert output cosine,same score endpoints but high interpolation barrier,output checkpoint keeps target config/tokenizer/model class/tensor names/tensor shapes
Router-aware MoE average,required_for_moe,not_applicable,freeze_router_or_train_audited_route_kd_delta,Freeze routers for expert candidate generation; treat router delta as separately audited ablation.,hard_route_load_capacity_and_matched_vllm_eval_must_pass,"Direct router movement allows 0/48 layers; router calibration NLL reduction is 0.2214, but candidate acceptance is still awaiting_baseline_eval.",MergeME; HARC; Qwen3; WEMoE,"[{""short_name"": ""WEMoE"", ""url"": ""https://arxiv.org/abs/2410.21804"", ""year"": ""2024""}, {""short_name"": ""MergeME"", ""url"": ""https://arxiv.org/abs/2502.00997"", ""year"": ""2025""}, {""short_name"": ""Qwen3"", ""url"": ""https://arxiv.org/abs/2505.09388"", ""year"": ""2025""}, {""short_name"": ""HARC"", ""url"": ""https://arxiv.org/abs/2606.03391"", ""year"": ""2026""}]",route overlap; router entropy; max expert fraction; top-k margin,routing breakdown; route collapse; low top-k agreement after merge,output checkpoint keeps target config/tokenizer/model class/tensor names/tensor shapes
