probe,what_it_measures,dense_decision,moe_decision,artifact_target
endpoint and held-in retention,Whether each source model's native ability survives the average.,Reject averages that improve mean score while sacrificing one expert.,Use per-domain retention before trusting route-aware rules.,method_metrics.csv; decision_table.csv
lambda path and midpoint barrier,Linear connectivity between endpoints or between anchor and source.,Low barrier supports soups/task arithmetic; high barrier triggers alignment or layer-wise coefficients.,"Run shared-only, router-frozen, and all-weight paths separately.",path_metrics.csv; qwen path sweep; alpha/beta grids
delta cosine and sign conflict,Parameter-level direction agreement and destructive sign disagreement.,Choose TIES/DARE/DELLA/STAR or freeze conflict-heavy groups.,"Compute per shared module and per matched expert, never only globally.",delta_summary.csv; interference.csv
activation/Fisher sensitivity,Which parameters or linear layers are important on calibration data.,Use Fisher/RegMean/AdaMerging style coefficients.,Compute route-conditioned sensitivity for experts and router.,future activation covariance and Fisher summaries
router entropy and route overlap,Whether MoE routing still dispatches tokens to appropriate experts after merging.,Not applicable.,Freeze/calibrate router or reject all-weight average if overlap collapses.,router_summary.csv; route_overlap.csv; router_readiness.csv
expert output similarity,Whether expert index e in two checkpoints represents the same function.,Use analogous feature alignment only if initialization differs.,Build expert remap aliases before averaging expert tensors.,expert_match.csv; source_tensor_aliases.txt
